Product Url,Product Name,Brand,Product ID,Price,Rating,Number of Reviews,Parent Category,Sub Category,Sales Rank(in parent category),Sales Rank(in sub category),Release Date,Country of Origin,Purchased in Last Month
https://www.amazon.com/Blink-Plus-Plan-monthly-auto-renewal/dp/B08JHCVHTY/ref=zg_bs_g_amazon-devices_d_sccl_1/135-4977875-3732765?psc=1,,,,10.0,,,,,,,,,
https://www.amazon.com/amazon-fire-tv-stick-hd/dp/B0CQMRKRV5/ref=zg_bs_g_amazon-devices_d_sccl_2/135-4977875-3732765?psc=1,"Amazon Fire TV Stick HD (newest model), free and live TV, Alexa Voice Remote, smart home controls, HD streaming",Amazon Fire TV,B0CQMRKRV5,17.99,4.7,38587.0,,,,,,,
https://www.amazon.com/Ring-Battery-Doorbell-Head-to-Toe-Video-Satin-Nickel/dp/B0BZWRSRWV/ref=zg_bs_g_amazon-devices_d_sccl_3/135-4977875-3732765?psc=1,"Ring Battery Doorbell | Home or business security with Head-to-Toe Video, Live View with Two-Way Talk, and Motion Detection & Alerts (newest model), Satin Nickel",Ring,B0BZWRSRWV,37.49,4.6,27678.0,,,,,,,
https://www.amazon.com/Blink-Outdoor-newest-model-Wireless/dp/B0DHLQT3CG/ref=zg_bs_g_amazon-devices_d_sccl_4/135-4977875-3732765?psc=1,"Blink Outdoor 4 (newest model) – Wireless smart security camera, two-year battery life, 1080p HD day and infrared night live view, two-way talk. Sync Module Core included – 3 camera system",Blink,B0DHLQT3CG,74.99,4.2,10549.0,,,,,,,
https://www.amazon.com/Amazon-Fire-TV-Stick-4K-streaming-device/dp/B0CJM1GNFQ/ref=zg_bs_g_amazon-devices_d_sccl_5/135-4977875-3732765?psc=1,"Amazon Fire TV Stick 4K (newest model) with AI-powered Fire TV Search, Wi-Fi 6, stream over 1.8 million movies and shows, free & live TV",Amazon Fire TV,B0CJM1GNFQ,24.99,4.7,86412.0,,,,,,,
https://www.amazon.com/Blink-Video-Doorbell-Sync-Module-Core-Included-System-Black/dp/B0DGQZ8JZK/ref=zg_bs_g_amazon-devices_d_sccl_6/135-4977875-3732765?psc=1,"Blink Video Doorbell (newest model) – Head-to-toe HD view, two-year battery life, and simple setup. Sync Module Core included – System (Black)",Blink,B0DGQZ8JZK,34.99,4.3,6655.0,,,,,,,
https://www.amazon.com/introducing-the-all-new-Ring-Indoor-Cam/dp/B0B6GLQJMV/ref=zg_bs_g_amazon-devices_d_sccl_7/135-4977875-3732765?psc=1,"Ring Indoor Cam (newest model) — Home or business security in 1080p HD video, White",Ring,B0B6GLQJMV,18.74,4.7,32926.0,,,,,,,
https://www.amazon.com/Blink-Mini-2-Camera-White/dp/B0BWWZXWPL/ref=zg_bs_g_amazon-devices_d_sccl_8/135-4977875-3732765?psc=1,"Blink Mini 2 (newest model) — Home Security & Pet Camera with HD video, color night view, motion detection, two-way audio, and built-in spotlight — 1 camera (White)",Blink,B0BWWZXWPL,19.99,4.4,14672.0,,,,,,,
https://www.amazon.com/all-new-amazon-fire-tv-stick-4k-max/dp/B0BP9SNVH9/ref=zg_bs_g_amazon-devices_d_sccl_9/135-4977875-3732765?psc=1,"Amazon Fire TV Stick 4K Max streaming device (newest model) with AI-powered Fire TV Search, supports Wi-Fi 6E, free & live TV without cable or satellite",Amazon Fire TV,B0BP9SNVH9,39.99,4.6,62882.0,,,,,,,
https://www.amazon.com/Ring-Outdoor-Cam-Plus-Battery-White/dp/B0D241GHP5/ref=zg_bs_g_amazon-devices_d_sccl_10/135-4977875-3732765?psc=1,"Introducing Ring Outdoor Cam Plus, Battery — Wide-Angle 2K Video with Ring Vision, Low-Light Sight for full-color night vision, Mount-Anywhere Versatility, White",Ring,B0D241GHP5,59.99,4.5,2677.0,,,,,,,
https://www.amazon.com/Amazon-vibrant-helpful-routines-Charcoal/dp/B09B8V1LZ3/ref=zg_bs_g_amazon-devices_d_sccl_11/135-4977875-3732765?psc=1,"Amazon Echo Dot (newest model), Vibrant sounding Alexa speaker, Great for bedrooms, dining rooms and offices, Charcoal",Amazon Echo & Alexa,B09B8V1LZ3,26.24,4.7,171526.0,,,,,,,
https://www.amazon.com/All-new-Amazon-Kindle-Paperwhite-glare-free/dp/B0CFPJYX7P/ref=zg_bs_g_amazon-devices_d_sccl_12/135-4977875-3732765?psc=1,"Amazon Kindle Paperwhite 16GB (newest model) – Our fastest Kindle ever, with new 7"" glare-free display and weeks of battery life – Black",Amazon Kindle,B0CFPJYX7P,140.79,4.6,12012.0,,,,,,,
https://www.amazon.com/Ring-Floodlight-Cam-Wired-Plus/dp/B08F6GPQQ7/ref=zg_bs_g_amazon-devices_d_sccl_13/135-4977875-3732765?psc=1,"Ring Floodlight Cam Wired Plus — Outdoor home or business security with motion-activated 1080p HD video and floodlights, (2021 release) White",Ring,B08F6GPQQ7,99.99,4.7,39727.0,,,,,,,
https://www.amazon.com/Ring-Chime/dp/B09L45VFCN/ref=zg_bs_g_amazon-devices_d_sccl_14/135-4977875-3732765?psc=1,Ring Chime,Ring,B09L45VFCN,27.71,4.6,46792.0,,,,,,,
https://www.amazon.com/Amazon-Echo-Alexa-fits-anywhere/dp/B09WNK39JN/ref=zg_bs_g_amazon-devices_d_sccl_15/135-4977875-3732765?psc=1,"Amazon Echo Pop (newest model), Our smallest Alexa speaker, Fits in any room, Charcoal",Amazon Echo & Alexa,B09WNK39JN,24.99,4.7,96685.0,,,,,,,
https://www.amazon.com/Ring-Spotlight-Cam-Plus-Battery-White/dp/B09JZ5BG26/ref=zg_bs_g_amazon-devices_d_sccl_16/135-4977875-3732765?psc=1,"Ring Spotlight Cam Plus, Battery | Home or business security with HD video, Two-Way Talk, Color Night Vision, and Security Siren (2022 release) - White",Ring,B09JZ5BG26,67.49,4.5,20103.0,,,,,,,
https://www.amazon.com/Ring-Rechargeable-Battery-Pack/dp/B076JKHDQT/ref=zg_bs_g_amazon-devices_d_sccl_17/135-4977875-3732765?psc=1,Ring Rechargeable Quick Release Battery Pack,Ring,B076JKHDQT,27.71,4.7,124016.0,,,,,,,
https://www.amazon.com/Amazon-Kindle/dp/B0CNV9F72P/ref=zg_bs_g_amazon-devices_d_sccl_18/135-4977875-3732765?psc=1,"Amazon Kindle 16 GB (newest model) - Lightest and most compact Kindle, now with faster page turns, and higher contrast ratio, for an enhanced reading experience - Black",Amazon Kindle,B0CNV9F72P,82.52,4.6,9250.0,,,,,,,
https://www.amazon.com/All-new-Ring-Battery-Doorbell-detection/dp/B09WZBPX7K/ref=zg_bs_g_amazon-devices_d_sccl_19/135-4977875-3732765?psc=1,"Ring Battery Doorbell Plus (newest model) | Head-to-Toe HD+ Video, motion detection & alerts, and Two-Way Talk",Ring,B09WZBPX7K,59.99,4.6,13176.0,,,,,,,
https://www.amazon.com/Blink-Outdoor-XR-newest-model/dp/B0DV4VQL6Y/ref=zg_bs_g_amazon-devices_d_sccl_20/135-4977875-3732765?psc=1,"Blink Outdoor 4 XR (newest model) – two-year battery wireless camera with 4x security coverage, 1000 ft open-air range or 400 ft with typical use — 4 camera system",Blink,B0DV4VQL6Y,119.99,4.3,1917.0,,,,,,,
https://www.amazon.com/All-new-Echo-Show-5/dp/B09B2SBHQK/ref=zg_bs_g_amazon-devices_d_sccl_21/135-4977875-3732765?psc=1,"Amazon Echo Show 5 (newest model), Smart display with 2x the bass and clearer sound, Charcoal",Amazon Echo & Alexa,B09B2SBHQK,48.39,4.4,54114.0,,,,,,,
https://www.amazon.com/Blink-Mini-White-2Cam/dp/B07X27VK3D/ref=zg_bs_g_amazon-devices_d_sccl_22/135-4977875-3732765?psc=1,"Blink Mini - Compact indoor plug-in smart security camera, 1080p HD video, night vision, motion detection, two-way audio, easy set up, Works with Alexa – 2 cameras (White)",Blink,B07X27VK3D,29.99,4.4,303808.0,,,,,,,
https://www.amazon.com/Amazon_Fire_HD_10/dp/B0BHZT5S12/ref=zg_bs_g_amazon-devices_d_sccl_23/135-4977875-3732765?psc=1,"Amazon Fire HD 10 tablet (newest model) built for relaxation, 10.1"" vibrant Full HD screen, octa-core processor, 3 GB RAM, 32 GB, Black",Amazon Fire Tablets,B0BHZT5S12,59.49,4.5,32393.0,,,,,,,
https://www.amazon.com/INSIGNIA-Class-Smart-Remote-NS-50F502NA26/dp/B0F1DGM1TM/ref=zg_bs_g_amazon-devices_d_sccl_24/135-4977875-3732765?psc=1,"INSIGNIA 50"" Class F50 Series LED 4K UHD Smart Fire TV with Alexa Voice Remote (NS-50F502NA26)",INSIGNIA,B0F1DGM1TM,169.99,4.2,2653.0,Amazon Devices & Accessories,Smart TVs,24.0,1.0,"March 13, 2025",,
https://www.amazon.com/Ring-Video-Doorbell-Pro-2/dp/B086Q54K53/ref=zg_bs_g_amazon-devices_d_sccl_25/135-4977875-3732765?psc=1,Ring Wired Doorbell Pro (newest model) – Best-in-class with cutting-edge features (existing doorbell wiring required),Ring,B086Q54K53,97.49,4.5,10189.0,,,,,,,
https://www.amazon.com/Ring-Solar-Panel-Generation-Spotlight/dp/B0B27JY45L/ref=zg_bs_g_amazon-devices_d_sccl_26/135-4977875-3732765?psc=1,"Ring Solar Panel (2nd Generation), 4W for Outdoor Cam Plus, Outdoor Cam (Stick Up Cam), Stick Up Cam Pro, Spotlight Cam Plus, Spotlight Cam Pro - White",Ring,B0B27JY45L,59.99,4.6,10852.0,,,,,,,
https://www.amazon.com/All-New-Echo-Show-8/dp/B0BLS3Y632/ref=zg_bs_g_amazon-devices_d_sccl_27/135-4977875-3732765?psc=1,"Amazon Echo Show 8 (newest model), With Spatial Audio, Smart Home Hub, and Alexa, Charcoal",Amazon Echo & Alexa,B0BLS3Y632,74.99,4.5,25452.0,,,,,,,
https://www.amazon.com/Ring-Pan-Tilt-Indoor-Cam-White/dp/B0CG2VS5FD/ref=zg_bs_g_amazon-devices_d_sccl_28/135-4977875-3732765?psc=1,"Ring Pan-Tilt Indoor Cam | See all around your home or business with 360° pan coverage, HD video, plus Two-Way Talk (2024 release) | White",Ring,B0CG2VS5FD,39.99,4.7,5187.0,,,,,,,
https://www.amazon.com/Blink-Outdoor-4th-Gen-2-Camera/dp/B0B1N6B8QT/ref=zg_bs_g_amazon-devices_d_sccl_29/135-4977875-3732765?psc=1,"Blink Outdoor 4 (newest model), Wireless smart security camera, two-year battery, 1080p HD day and infrared night live view, two-way talk – 2 camera system",Blink,B0B1N6B8QT,52.49,4.2,42891.0,,,,,,,
https://www.amazon.com/Amazon-Echo-Spot-2024-release-Smart-alarm-clock-with-vibrant-sound-Alexa-Black/dp/B0BFC7WQ6R/ref=zg_bs_g_amazon-devices_d_sccl_30/135-4977875-3732765?psc=1,"Amazon Echo Spot (newest model), Great for nightstands, offices and kitchens, Smart alarm clock with Alexa, Black",Amazon Echo & Alexa,B0BFC7WQ6R,37.49,4.6,31909.0,,,,,,,
https://www.amazon.com/INSIGNIA-40-inch-LED-FHD-Fire-TV/dp/B0F7RXTN1Y/ref=zg_bs_g_amazon-devices_d_sccl_31/135-4977875-3732765?psc=1,"INSIGNIA 40"" Class F40 Series LED Full HD Smart Fire TV with Alexa Voice Remote (NS-40F401NA26)",INSIGNIA,B0F7RXTN1Y,109.99,4.5,511.0,Amazon Devices & Accessories,Televisions,31.0,2.0,"May 29, 2025",,
https://www.amazon.com/All-new-Amazon-Kindle-Paperwhite-Signature/dp/B0C8RR4WN3/ref=zg_bs_g_amazon-devices_d_sccl_32/135-4977875-3732765?psc=1,"Amazon Kindle Paperwhite Signature Edition 32GB (newest model) – Our fastest Kindle with auto-adjusting front light, wireless charging, and weeks of battery life – Metallic Black",Amazon Kindle,B0C8RR4WN3,199.99,4.6,6924.0,,,,,,,
https://www.amazon.com/Ring-Chime-Pro/dp/B07WML2XTD/ref=zg_bs_g_amazon-devices_d_sccl_33/135-4977875-3732765?psc=1,Ring Chime Pro,Ring,B07WML2XTD,58.4,4.6,55479.0,,,,,,,
https://www.amazon.com/Blink-Wired-Floodlight-Camera-White/dp/B0B5VLCL1N/ref=zg_bs_g_amazon-devices_d_sccl_34/135-4977875-3732765?psc=1,"Blink Wired Floodlight Camera - Smart security camera, 2600 lumens, HD live view, enhanced motion detection, built-in siren, Works with Alexa – 1 camera (White)",Blink,B0B5VLCL1N,49.99,4.2,10869.0,,,,,,,
https://www.amazon.com/Amazon-Paperwhite-Lightweight-Water-Safe-Protective/dp/B0CM7X424T/ref=zg_bs_g_amazon-devices_d_sccl_35/135-4977875-3732765?psc=1,"Amazon Kindle Paperwhite and Kindle Colorsoft Case, Lightweight and Water-Safe, Foldable Protective Cover - Fabric",Brand: Amazon,B0CM7X424T,36.99,4.7,6700.0,,,,,"October 20, 2024",,
https://www.amazon.com/Ring-Outdoor-Weather-Resistant-Camera-Two-Way/dp/B0C5QRZ47P/ref=zg_bs_g_amazon-devices_d_sccl_36/135-4977875-3732765?psc=1,"Ring Outdoor Cam (Stick Up Cam) | Weather-Resistant Outdoor Camera, Live View, Color Night Vision, Two-Way Talk, Motion alerts, Works with Alexa | White",Ring,B0C5QRZ47P,59.99,4.6,59183.0,,,,,,,
https://www.amazon.com/Eero-6-Extender/dp/B085VQVPJK/ref=zg_bs_g_amazon-devices_d_sccl_37/135-4977875-3732765?psc=1,"Amazon eero 6 mesh wifi extender - Add up to 1,500 sq. ft. of Wi-Fi 6 coverage to your existing eero mesh wifi network",eero,B085VQVPJK,54.99,4.4,27237.0,,,,,,,
https://www.amazon.com/Amazon-smart-plug-works-with-Alexa/dp/B089DR29T6/ref=zg_bs_g_amazon-devices_d_sccl_38/135-4977875-3732765?psc=1,"Amazon Smart Plug | Works with Alexa | Simple setup, endless possibilities",Amazon Smart Home,B089DR29T6,24.99,4.7,570331.0,,,,,,,
https://www.amazon.com/Ring-Floodlight-Wired-Motion-Detection/dp/B0CG6VFFVL/ref=zg_bs_g_amazon-devices_d_sccl_39/135-4977875-3732765?psc=1,"Ring Floodlight Cam Wired Pro with Bird’s Eye View and 3D Motion Detection, White",Ring,B0CG6VFFVL,159.99,4.6,10333.0,,,,,,,
https://www.amazon.com/Amazon-Fire-Kids-tablet-Top-selling/dp/B0BL8WSCH3/ref=zg_bs_g_amazon-devices_d_sccl_40/135-4977875-3732765?psc=1,"Amazon Fire 7 Kids tablet (newest model) ages 3-7. Top-selling 7"" kids tablet on Amazon. Includes ad-free and exclusive content, easy parental controls, 10-hr battery, 16 GB, Purple",Amazon Fire Tablets,B0BL8WSCH3,54.99,4.4,28197.0,,,,,,,
https://www.amazon.com/Ring-Battery-Doorbell-Pro-Video-Camera/dp/B0B2BY4ZG7/ref=zg_bs_g_amazon-devices_d_sccl_41/135-4977875-3732765?psc=1,"Ring Battery Doorbell Pro (newest model), Two-Way Talk with Audio+, 3D Motion Detection, and 1536p HD+ Head-to-Toe Video",Ring,B0B2BY4ZG7,97.49,4.5,2297.0,,,,,,,
https://www.amazon.com/Ring-Solar-Charger-for-Battery-Doorbell/dp/B0CLMJ6HJP/ref=zg_bs_g_amazon-devices_d_sccl_42/135-4977875-3732765?psc=1,All-new Ring Solar Charger for Battery Doorbell,Ring,B0CLMJ6HJP,49.49,4.0,15165.0,,,,,,,
https://www.amazon.com/Fire-HD-8-Tablet-Black-32GB/dp/B0CVDN4QS6/ref=zg_bs_g_amazon-devices_d_sccl_43/135-4977875-3732765?psc=1,"Amazon Fire HD 8 tablet (newest model), 8” HD Display, 3GB memory, 32GB, designed for portable entertainment, Black",Amazon Fire Tablets,B0CVDN4QS6,54.99,4.5,5927.0,,,,,,,
https://www.amazon.com/INSIGNIA-32-inch-LED-HD-Fire-TV/dp/B0F7RZ1MS9/ref=zg_bs_g_amazon-devices_d_sccl_44/135-4977875-3732765?psc=1,"INSIGNIA 32"" Class F20 Series LED HD Smart Fire TV with Alexa Voice Remote (NS-32F201NA26)",Amazon Fire TV,B0F7RZ1MS9,79.99,4.5,167.0,,,,,,,
https://www.amazon.com/tcl-fire-tv-55-inch-class-s5-4k-smart-tv/dp/B0D4PD799H/ref=zg_bs_g_amazon-devices_d_sccl_45/135-4977875-3732765?psc=1,"TCL 55-Inch Class S5 UHD 4K LED Smart TV with Fire TV (55S551F, 2024 Model), Dolby Vision, HDR PRO+, Dolby Atmos, Alexa Built-in with Voice Remote, Apple AirPlay 2 Compatibility, Streaming Television",TCL,B0D4PD799H,249.99,4.0,2834.0,Amazon Devices & Accessories,Televisions,45.0,4.0,"June 16, 2024",,
https://www.amazon.com/Introducing-alexa-voice-remote-pro/dp/B09RX4HKTD/ref=zg_bs_g_amazon-devices_d_sccl_46/135-4977875-3732765?psc=1,"Amazon Fire TV Alexa Voice Remote Pro (newest model) with remote finder, TV controls, and backlit buttons",Amazon Fire TV Accessories,B09RX4HKTD,24.99,4.5,21040.0,,,,,,,
https://www.amazon.com/fire-tv-stick-with-3rd-gen-alexa-voice-remote/dp/B08C1W5N87/ref=zg_bs_g_amazon-devices_d_sccl_47/135-4977875-3732765?psc=1,"Amazon Fire TV Stick, sharp picture quality, fast streaming, free & live TV, Alexa Voice Remote with TV controls",Amazon Fire TV,B08C1W5N87,39.99,4.7,518963.0,,,,,,,
https://www.amazon.com/Ring-Spotlight-Cam-Pro-Battery-White/dp/B09DRX62ZV/ref=zg_bs_g_amazon-devices_d_sccl_48/135-4977875-3732765?psc=1,"Ring Spotlight Cam Pro, Battery | 3D Motion Detection, Two-Way Talk with Audio+, and Dual-Band Wifi (2022 release) - White",Ring,B09DRX62ZV,139.99,4.4,5089.0,,,,,,,
https://www.amazon.com/Amazon_Fire_HD_10_Kids_Pro/dp/B0BL6DCNGR/ref=zg_bs_g_amazon-devices_d_sccl_49/135-4977875-3732765?psc=1,"Amazon Fire HD 10 Kids Pro tablet (newest model) ages 6-12. Bright 10.1"" HD screen, includes ad-free content, robust parental controls, 13-hr battery and slim case for older kids, 32 GB, Nebula",Amazon Fire Tablets,B0BL6DCNGR,104.99,4.6,7764.0,,,,,,,
https://www.amazon.com/Blink-Sync-Module-2/dp/B084RQ6MHJ/ref=zg_bs_g_amazon-devices_d_sccl_50/135-4977875-3732765?psc=1,Blink Add-On Sync Module 2,Blink,B084RQ6MHJ,49.99,4.4,47681.0,,,,,,,
https://www.amazon.com/amazon-fire-tv-32-inch-2-series-hd-smart-tv/dp/B0CJDSNN4T/ref=zg_bs_g_amazon-devices_d_sccl_1/135-4977875-3732765?psc=1,"Amazon Fire TV 32"" 2-Series (newest model), HD smart TV with Fire TV Alexa Voice Remote, stream live TV without cable",Amazon Fire TV,B0CJDSNN4T,109.99,4.4,12667.0,,,,,,,
https://www.amazon.com/Ring-Video-Doorbell-Wired/dp/B08CKHPP52/ref=zg_bs_g_amazon-devices_d_sccl_2/135-4977875-3732765?psc=1,"Ring Video Doorbell Wired (newest model), Use Two-Way Talk, advanced motion detection, HD camera and real-time alerts to monitor your front door (wiring required)",Ring,B08CKHPP52,49.99,4.4,77619.0,,,,,,,
https://www.amazon.com/Introducing-Ring-pet-tag/dp/B0BLXHWPLP/ref=zg_bs_g_amazon-devices_d_sccl_3/135-4977875-3732765?psc=1,Ring Pet Tag | Easy-to-use tag with QR code | Real-time scan alerts | Shareable Pet Profile | No subscription or fees,Ring,B0BLXHWPLP,9.99,4.5,3243.0,,,,,,,
https://www.amazon.com/Amazon-Official-Charger-Adapter-eReaders/dp/B01I0IGFKC/ref=zg_bs_g_amazon-devices_d_sccl_4/135-4977875-3732765?psc=1,"Amazon 9W Official OEM USB Charger and Power Adapter for Fire Tablets, Kindle eReaders, and Echo Dot",Amazon Fire TV Accessories,B01I0IGFKC,19.99,4.7,17965.0,,,,,,,
https://www.amazon.com/All-new-fire-tv-cube-4k-streaming-device/dp/B09BZZ3MM7/ref=zg_bs_g_amazon-devices_d_sccl_5/135-4977875-3732765?psc=1,"Amazon Fire TV Cube (newest model) with AI-powered Fire TV Search, Hands-free streaming device with Alexa, Wi-Fi 6E, 4K Ultra HD",Amazon Fire TV,B09BZZ3MM7,84.99,4.5,14551.0,,,,,,,
https://www.amazon.com/Amazon-Fire-TV-Stick-Max/dp/B0BXLZHDNC/ref=zg_bs_g_amazon-devices_d_sccl_6/135-4977875-3732765?psc=1,"Like-New Amazon Fire TV Stick 4K Max streaming device (newest model) supports Wi-Fi 6E, free & live TV without cable or satellite",Amazon Fire TV,B0BXLZHDNC,35.99,4.6,1745.0,,,,,,,
https://www.amazon.com/Echo-Show-15-Smart-Display/dp/B0C5DPSW5Y/ref=zg_bs_g_amazon-devices_d_sccl_7/135-4977875-3732765?psc=1,"Amazon Echo Show 15 (newest model), Full HD 15.6"" kitchen hub for home organization, with built-in Fire TV and Alexa",Amazon Echo & Alexa,B0C5DPSW5Y,299.99,4.4,2885.0,,,,,,,
https://www.amazon.com/Introducing-Amazon-eero-dual-band-router/dp/B0D955ZMSR/ref=zg_bs_g_amazon-devices_d_sccl_8/135-4977875-3732765?psc=1,"Amazon eero 7 dual-band mesh Wi-Fi 7 router (newest model) - Supports internet plans up to 2.5 Gbps, Coverage up to 6,000 sq. ft., 3-pack",eero,B0D955ZMSR,279.99,4.4,632.0,,,,,,,
https://www.amazon.com/Amazon-Kindle-Case/dp/B0CX4XSY3X/ref=zg_bs_g_amazon-devices_d_sccl_9/135-4977875-3732765?psc=1,"Amazon Kindle Case, Thin and Lightweight, Foldable Protective Cover - Fabric",Brand: Amazon,B0CX4XSY3X,24.6,4.7,5992.0,,,,,"October 16, 2024",,
https://www.amazon.com/Anti-Glare-Screen-Protector-Amazon-release/dp/B0BNPF5VNW/ref=zg_bs_g_amazon-devices_d_sccl_10/135-4977875-3732765?psc=1,"Anti-Glare Screen Protector (2 Pack), for Amazon Fire HD 10, (13th Gen, 2023 release)",Amazon Fire Tablet Accessories,B0BNPF5VNW,17.99,4.5,4995.0,,,,,,,
https://www.amazon.com/Amazon-Mission-Power-Eliminates-Adapter/dp/B078KSHVCS/ref=zg_bs_g_amazon-devices_d_sccl_11/135-4977875-3732765?psc=1,"Made for Amazon, USB Power Cable (Eliminates the Need for AC Adapter)",Mission Cables,B078KSHVCS,30.0,4.6,71851.0,,,,,,,
https://www.amazon.com/Adjustable-Stand-with-USB-C-Charging-Port/dp/B0BVP386MC/ref=zg_bs_g_amazon-devices_d_sccl_12/135-4977875-3732765?psc=1,Echo Show 8 (3rd Gen) Adjustable Stand with USB-C Charging Port | Charcoal,Amazon Echo Accessories,B0BVP386MC,23.74,4.5,9417.0,,,,,,,
https://www.amazon.com/SanDisk-micro-Memory-Card-Tablets/dp/B013TMNPBQ/ref=zg_bs_g_amazon-devices_d_sccl_13/135-4977875-3732765?psc=1,Made for Amazon SanDisk 128GB microSD Memory Card for Fire Tablets and Fire -TV,SanDisk,B013TMNPBQ,15.15,4.6,93636.0,Amazon Devices & Accessories,Micro SD Memory Cards,63.0,1.0,"‎September 16, 2015",,
https://www.amazon.com/eero-reliable-gigabit-connect-Coverage/dp/B08ZK2BHP2/ref=zg_bs_g_amazon-devices_d_sccl_14/135-4977875-3732765?psc=1,"Amazon eero 6+ mesh wifi system - Supports internet plans up to a Gigabit, Coverage up to 4,500 sq. ft., Connect 75+ devices, 3-pack",eero,B08ZK2BHP2,194.99,4.4,9667.0,,,,,,,
https://www.amazon.com/INSIGNIA-24-inch-LED-HD-Fire-TV/dp/B0F9Z3H6YG/ref=zg_bs_g_amazon-devices_d_sccl_15/135-4977875-3732765?psc=1,INSIGNIA 24” Class F20 Series LED HD Smart Fire TV with Alexa Voice Remote (NS-24F201NA26),INSIGNIA,B0F9Z3H6YG,59.99,4.5,1175.0,Amazon Devices & Accessories,Televisions,65.0,7.0,"May 27, 2025",,
https://www.amazon.com/All-new-Ring-No-Drill-Battery-Doorbell/dp/B0CG2JMX5X/ref=zg_bs_g_amazon-devices_d_sccl_16/135-4977875-3732765?psc=1,"Ring No-Drill Mount for Ring Video Doorbell 3, Video Doorbell 3 Plus, Video Doorbell 4, Battery Doorbell Plus, Battery Doorbell Pro and Battery Doorbell",Ring,B0CG2JMX5X,15.08,4.3,13956.0,,,,,,,
https://www.amazon.com/All-new-Blink-Sync-Module-XR/dp/B0B198XD6X/ref=zg_bs_g_amazon-devices_d_sccl_17/135-4977875-3732765?psc=1,"Blink Sync Module XR (newest model) — System hub for all Blink devices, go up to 400 feet from your home with extended range for Outdoor 4",Blink,B0B198XD6X,69.99,4.4,2500.0,,,,,,,
https://www.amazon.com/Ring-Charging-Station-Release-Battery/dp/B08CKJV9Z6/ref=zg_bs_g_amazon-devices_d_sccl_18/135-4977875-3732765?psc=1,Ring Charging Station for Quick Release Battery Pack,Ring,B08CKJV9Z6,44.01,4.5,7461.0,,,,,,,
https://www.amazon.com/Ring-Spare-Parts-Doorbell-Generation/dp/B0B72GF2MH/ref=zg_bs_g_amazon-devices_d_sccl_19/135-4977875-3732765?psc=1,Ring Spare Parts Kit for Video Doorbell (2nd Generation),Ring,B0B72GF2MH,4.99,4.7,26097.0,,,,,,,
https://www.amazon.com/Blink--Mini-2-Power-Adpater/dp/B0CBL57VRT/ref=zg_bs_g_amazon-devices_d_sccl_20/135-4977875-3732765?psc=1,Blink Weather Resistant 13ft Power Adapter for Blink Mini 2 and Blink Outdoor 4 (Black),Blink,B0CBL57VRT,9.99,4.6,2108.0,,,,,,,
https://www.amazon.com/Like-New-Blink-Wire-free-security-detection/dp/B0B1N6CR7X/ref=zg_bs_g_amazon-devices_d_sccl_21/135-4977875-3732765?psc=1,"Like-New Blink Outdoor 4 (newest model), Wire-free smart security camera, two-year battery life, two-way audio, HD live view, enhanced motion detection, Works with Alexa – 2 camera system",Blink,B0B1N6CR7X,65.99,4.4,1500.0,,,,,,,
https://www.amazon.com/Ring-Plug-Mount-Floodlight-Cams/dp/B093BBBM3T/ref=zg_bs_g_amazon-devices_d_sccl_22/135-4977875-3732765?psc=1,Ring Plug-In Mount for Floodlight Cams - White,Ring,B093BBBM3T,19.0,4.7,5962.0,,,,,,,
https://www.amazon.com/amazon-fire-tv-50-inch-4-series-4k-smart-tv/dp/B0CZBLZYY5/ref=zg_bs_g_amazon-devices_d_sccl_23/135-4977875-3732765?psc=1,"Amazon Fire TV 50"" 4-Series 4K UHD smart TV, stream live TV without cable, 2024 release",Amazon Fire TV,B0CZBLZYY5,259.99,4.4,1452.0,,,,,,,
https://www.amazon.com/Ring-Alarm-14-piece-kit-2nd/dp/B08YMBQJ49/ref=zg_bs_g_amazon-devices_d_sccl_24/135-4977875-3732765?psc=1,Ring Alarm 14-Piece Kit – Wireless Smart Home Security System | Expandable | Easy Setup | Mobile App Control | 24/7 Professional Monitoring | Alexa Compatible,Ring,B08YMBQJ49,198.99,4.6,7383.0,,,,,,,
https://www.amazon.com/Fire-HD-8-Kids-Pro-Tablet-Hello-Teal-32GB/dp/B0D1DMSV9G/ref=zg_bs_g_amazon-devices_d_sccl_25/135-4977875-3732765?psc=1,"Amazon Fire HD 8 Kids Pro tablet (newest model), ages 6-12. Bright 8"" HD screen, includes ad-free content, parental controls, 13-hr battery, slim case for older kids, 32GB, Hello Teal",Amazon Fire Tablets,B0D1DMSV9G,64.99,4.7,2967.0,,,,,,,
https://www.amazon.com/Amazon-powerful-display-octa-core-processor/dp/B0B1VQ1ZQY/ref=zg_bs_g_amazon-devices_d_sccl_26/135-4977875-3732765?psc=1,"Amazon Fire Max 11 tablet (newest model) vivid 11” display, all-in-one for streaming, reading, and gaming, 14-hour battery life, optional stylus and keyboard, 64 GB, Gray",Amazon Fire Tablets,B0B1VQ1ZQY,139.99,4.4,14664.0,,,,,,,
https://www.amazon.com/All-new-Echo-Buds-2023-Release-True-Wireless-Earbuds/dp/B09JVG3TWX/ref=zg_bs_g_amazon-devices_d_sccl_27/135-4977875-3732765?psc=1,"Amazon Echo Buds (newest model), True Wireless Bluetooth 5.2 Earbuds with Alexa, audio personalization, multipoint, 20H battery with charging case, fast charging, sweat resistant, Black",Amazon Echo & Alexa,B09JVG3TWX,49.99,3.9,12806.0,,,,,,,
https://www.amazon.com/All-New-Blink-Outdoor-Floodlight-Mount/dp/B0BBSQN6Q2/ref=zg_bs_g_amazon-devices_d_sccl_28/135-4977875-3732765?psc=1,"Blink Outdoor 4 Floodlight Mount – Wire-free, 700 lumens, two-year battery life, set up in minutes",Blink,B0BBSQN6Q2,39.99,4.0,7324.0,,,,,,,
https://www.amazon.com/Amazon-Kindle-Scribe/dp/B0CZB9Z477/ref=zg_bs_g_amazon-devices_d_sccl_29/135-4977875-3732765?psc=1,"Amazon Kindle Scribe (64GB) - Your notes, documents and books, all in one place. With built-in AI notebook summarization. Includes Premium Pen - Metallic Jade",Amazon Kindle,B0CZB9Z477,339.99,4.4,2324.0,,,,,,,
https://www.amazon.com/Amazon_Fire_HD_10_Kids/dp/B0BL5SZ3VV/ref=zg_bs_g_amazon-devices_d_sccl_30/135-4977875-3732765?psc=1,"Amazon Fire HD 10 Kids tablet (newest model) ages 3-7 | Bright 10.1"" HD screen with included ad-free and exclusive content, robust parental controls, 13-hr battery, 32 GB, Blue",Amazon Fire Tablets,B0BL5SZ3VV,104.99,4.6,6057.0,,,,,,,
https://www.amazon.com/Amazon-Ethernet-Adapter-Fire-Devices/dp/B074TC662N/ref=zg_bs_g_amazon-devices_d_sccl_81/135-4977875-3732765?psc=1,Ethernet Adapter for Amazon Fire TV Devices,Amazon Fire TV Accessories,B074TC662N,14.99,4.5,75372.0,,,,,,,
https://www.amazon.com/Introducing-Amazon-Plant-Based-Lightweight-Sustainability/dp/B0CM82H71F/ref=zg_bs_g_amazon-devices_d_sccl_82/135-4977875-3732765?psc=1,"Amazon Plant-Based Leather Case- Lightweight, Protective Cover Designed with Sustainability in Mind for Kindle Paperwhite and Kindle Colorsoft",Brand: Amazon,B0CM82H71F,11.56,4.6,2978.0,,,,,"October 20, 2024",,
https://www.amazon.com/Blink-Mini-Pan-Tilt-Camera-Black/dp/B09N6D5SDX/ref=zg_bs_g_amazon-devices_d_sccl_83/135-4977875-3732765?psc=1,"Blink Mini Pan-Tilt Camera (newest model), Rotating indoor plug-in smart security camera, two-way audio, HD video, motion detection, Works with Alexa (Black)",Blink,B09N6D5SDX,39.99,4.5,18859.0,,,,,,,
